{
  "schemaVersion": 1,
  "id": "example-domain",
  "owner": "example-owner",
  "repo": "github:example-owner/example-domain",
  "version": "1.0.0",
  "platformRange": ">=3.0.0-alpha.1 <4.0.0",
  "dependsOn": [],
  "provides": {
    "rules": ["example-domain-data"],
    "skills": ["example-domain-review"],
    "mcpProfiles": [],
    "testingProfiles": ["smoke"]
  }
}
